{
  "id": "law-render",
  "job_title": "法务实习生",
  "company": "示例零售集团",
  "availability": "每周到岗 4 天，可连续实习 6 个月以上",
  "jd_text": "法务实习生（示例零售集团，虚构）\n\n工作职责\n1. 协助审阅及修订中英文合同与法律文件；\n2. 协助审核产品宣传广告与促销活动规则；\n3. 处理产品质量及宣传客诉；\n4. 进行法律法规与案例检索，撰写法律备忘录；\n5. 法律翻译，起草并整理股东会/董事会决议。\n\n任职要求\n1. 每周至少 4 天，实习期 6 个月以上；\n2. 通过法律职业资格考试、取得 A 证优先；\n3. 英文流利，工作细心，沟通能力强。\n",
  "requirements": [
    {
      "requirement": "中英文合同审阅",
      "category": "必备"
    },
    {
      "requirement": "法律检索与备忘录",
      "category": "必备"
    },
    {
      "requirement": "广告合规与客诉",
      "category": "必备"
    }
  ],
  "matches": [
    {
      "requirement": "中英文合同审阅",
      "ability_id": "law-ab-1",
      "ability_label": "合同审阅",
      "star_statement_ids": [
        "law-star-1"
      ],
      "match_level": "强",
      "reason": "审阅修订 40 份中英文合同"
    },
    {
      "requirement": "法律检索与备忘录",
      "ability_id": "law-ab-2",
      "ability_label": "法律检索",
      "star_statement_ids": [
        "law-star-2"
      ],
      "match_level": "强",
      "reason": "30 次检索、5 份备忘录"
    },
    {
      "requirement": "广告合规与客诉",
      "ability_id": "law-ab-3",
      "ability_label": "合规与沟通",
      "star_statement_ids": [
        "law-star-3"
      ],
      "match_level": "强",
      "reason": "审核 20 份宣传规则并处理 15 件客诉"
    }
  ],
  "selected_experience_ids": [
    "law-exp-1",
    "law-exp-2"
  ],
  "experience_rank": [
    {
      "experience_id": "law-exp-1",
      "rank": 1
    },
    {
      "experience_id": "law-exp-2",
      "rank": 2
    }
  ],
  "gaps": [],
  "preferences": {},
  "status": "draft",
  "versions": [
    {
      "version": 1,
      "created_at": "2026-01-01T00:00:00+08:00",
      "changes": "demo",
      "resume_json": {
        "header": {
          "job_title": "法务实习生",
          "availability": "每周到岗 4 天，可连续实习 6 个月以上"
        },
        "education": {
          "schools": [
            {
              "start": "2024-09",
              "end": "2027-06",
              "school": "示例大学",
              "college": "法学",
              "degree": "硕士",
              "note": "法律职业资格 A 证"
            }
          ],
          "fields": [
            {
              "label": "专业成绩",
              "text": "GPA 3.8/4.0，前 10%"
            },
            {
              "label": "主修课程",
              "text": "合同法（A）、公司法（A）、法律检索（A）"
            },
            {
              "label": "荣誉奖项",
              "text": "校级二等奖学金（前 10%）；模拟法庭比赛（优秀辩手）"
            }
          ]
        },
        "sections": [
          {
            "title": "实习经历",
            "experiences": [
              {
                "experience_id": "law-exp-1",
                "bullets": [
                  {
                    "label": "合同审阅与修订",
                    "desc": "审阅与修订 40 份中英文合同，标注风险条款并输出修改建议；5 份备忘录被主办律师采用。",
                    "bold": [
                      "40 份",
                      "风险条款",
                      "5 份"
                    ]
                  },
                  {
                    "label": "法律检索与备忘录",
                    "desc": "完成 30 次法规与案例检索，撰写 5 份法律备忘录；检索结论进入法律意见。",
                    "bold": [
                      "30 次",
                      "5 份"
                    ]
                  }
                ]
              },
              {
                "experience_id": "law-exp-2",
                "bullets": [
                  {
                    "label": "广告合规与客诉",
                    "desc": "审核 20 份产品宣传与促销规则，处理 15 件客诉；形成 1 份广告合规检查清单。",
                    "bold": [
                      "20 份",
                      "15 件",
                      "合规检查清单"
                    ]
                  }
                ]
              }
            ]
          }
        ],
        "abilities": [
          {
            "label": "合同审阅",
            "text": "审阅与修订 40 份中英文合同，能识别风险条款并输出修改建议；法律职业资格 A 证。",
            "bold": [
              "40 份",
              "风险条款",
              "A 证"
            ]
          },
          {
            "label": "法律检索与写作",
            "text": "熟练使用北大法宝与 Westlaw，完成 30 次检索并撰写 5 份法律备忘录。",
            "bold": [
              "北大法宝",
              "Westlaw",
              "5 份"
            ]
          },
          {
            "label": "合规与沟通",
            "text": "审核广告与促销规则、处理客诉，能与业务部门沟通并形成合规检查清单。",
            "bold": [
              "合规检查清单"
            ]
          }
        ]
      },
      "analysis_md": "# 法务实习生 · demo\n"
    }
  ],
  "created_at": "2026-01-01T00:00:00+08:00",
  "updated_at": "2026-01-01T00:00:00+08:00"
}